[
 {
  "category": "module",
  "subtype": "servo",
  "id": "xense-robotics-xense-robotics-aurora-lite-gripper",
  "vendor": "Xense Robotics",
  "model": "Xense Robotics Aurora Lite Gripper",
  "title": "Xense Robotics Aurora Lite Gripper",
  "url": "https://aifitlab.com/products/xense-robotics-aurora-lite-gripper",
  "source_tier": "B",
  "verified": false,
  "last_checked": "2026-10-28",
  "price_cny": 4500.0,
  "origin": "AI2FitLab / OpenELab 商城商品页归档（2026-10-28 抓取）",
  "notes": "",
  "specs": {
   "tau_peak_Nm": null,
   "tau_rated_Nm": null,
   "gear": null,
   "speed_noload_rpm": null,
   "mass_kg": 0.615,
   "armature_kgm2": null,
   "voltage_V": 24.0,
   "kt_Nm_per_A": null,
   "image_url": "https://cdn.shopify.com/s/files/1/0673/6848/5000/files/Xense_Robotics-Aurora_Lite_Gripper-new-main-1-1-3.jpg?v=1789315728",
   "image_source": "AI2FitLab / OpenELab 商城商品页归档 商品图",
   "temp_range": "0–45°C",
   "i_rated_A": 2.0,
   "tau_basis": null
  }
 },
 {
  "category": "module",
  "subtype": "servo",
  "id": "xense-robotics-xense-robotics-photon-tactile-sensor",
  "vendor": "Xense Robotics",
  "model": "Xense Robotics Photon Tactile Sensor",
  "title": "Xense Robotics Photon Tactile Sensor",
  "url": "https://aifitlab.com/products/xense-robotics-photon-tactile-sensor",
  "source_tier": "B",
  "verified": false,
  "last_checked": "2026-10-28",
  "price_cny": 625.0,
  "origin": "AI2FitLab / OpenELab 商城商品页归档（2026-10-28 抓取）",
  "notes": "",
  "specs": {
   "tau_peak_Nm": null,
   "tau_rated_Nm": null,
   "gear": null,
   "speed_noload_rpm": null,
   "mass_kg": null,
   "armature_kgm2": null,
   "voltage_V": 5.0,
   "kt_Nm_per_A": null,
   "image_url": "https://cdn.shopify.com/s/files/1/0673/6848/5000/files/Xense_Robotics-Photon-main-8.jpg?v=1787480196",
   "image_source": "AI2FitLab / OpenELab 商城商品页归档 商品图",
   "power_w": 0.6,
   "comm": "UVC",
   "tau_basis": null
  }
 }
]
