[
 {
  "category": "module",
  "subtype": "servo",
  "id": "limx-dynamics-limx-tron1-biped-robot",
  "vendor": "LimX Dynamics",
  "model": "LimX TRON1 Biped Robot",
  "title": "LimX TRON1 Biped Robot",
  "url": "https://aifitlab.com/products/limx-tron1-biped-robot",
  "source_tier": "B",
  "verified": false,
  "last_checked": "2026-10-28",
  "price_cny": 21600.0,
  "origin": "AI2FitLab / OpenELab 商城商品页归档（2026-10-28 抓取）",
  "notes": "",
  "specs": {
   "tau_peak_Nm": 60.0,
   "tau_rated_Nm": 30.0,
   "gear": null,
   "speed_noload_rpm": null,
   "mass_kg": null,
   "armature_kgm2": null,
   "voltage_V": 48.0,
   "kt_Nm_per_A": null,
   "image_url": "https://cdn.shopify.com/s/files/1/0673/6848/5000/files/LIMX_TRON1-main-1-1.jpg?v=1775472899",
   "image_source": "AI2FitLab / OpenELab 商城商品页归档 商品图",
   "dims": "≤ 392mm x 420mm x 845mm",
   "tau_basis": "peak"
  }
 }
]
