[
 {
  "category": "module",
  "subtype": "servo",
  "id": "box2ai-box2ai-boxarm-b1-robotic-arm",
  "vendor": "Box2AI",
  "model": "Box2AI BoxARM-B1 Robotic Arm",
  "title": "Box2AI BoxARM-B1 Robotic Arm",
  "url": "https://aifitlab.com/products/box2ai-boxarm-b1-robotic-arm",
  "source_tier": "B",
  "verified": false,
  "last_checked": "2026-10-28",
  "price_cny": 330.0,
  "origin": "AI2FitLab / OpenELab 商城商品页归档（2026-10-28 抓取）",
  "notes": "",
  "specs": {
   "tau_peak_Nm": null,
   "tau_rated_Nm": null,
   "gear": null,
   "speed_noload_rpm": null,
   "mass_kg": null,
   "armature_kgm2": null,
   "voltage_V": 24.0,
   "kt_Nm_per_A": null,
   "image_url": "https://cdn.shopify.com/s/files/1/0673/6848/5000/files/BoxesAI_BoxARM-B1-main-1-1.jpg?v=1766398131",
   "image_source": "AI2FitLab / OpenELab 商城商品页归档 商品图",
   "power_w": 300.0,
   "tau_basis": null
  }
 }
]
