[
 {
  "category": "actuator",
  "subtype": "servo",
  "id": "fashion-star-fashion-star-hx8-u29h-m-uart-bus-servo",
  "vendor": "Fashion Star",
  "model": "Fashion Star HX8-U29H-M UART Bus Servo",
  "title": "Fashion Star HX8-U29H-M UART Bus Servo",
  "url": "https://aifitlab.com/products/fashion-star-hx8-u29h-m-uart-bus-servo",
  "source_tier": "B",
  "verified": false,
  "last_checked": "2026-10-28",
  "price_cny": 195.0,
  "origin": "AI2FitLab / OpenELab 商城商品页归档（2026-10-28 抓取）",
  "notes": "仅公布堵转扭矩，未公布峰值（堵转 ≠ 峰值，不互相顶替）",
  "specs": {
   "tau_peak_Nm": null,
   "tau_rated_Nm": null,
   "gear": 173.0,
   "speed_noload_rpm": 150.0,
   "mass_kg": 0.083,
   "armature_kgm2": null,
   "voltage_V": 12.6,
   "kt_Nm_per_A": null,
   "image_url": "https://cdn.shopify.com/s/files/1/0673/6848/5000/files/Fashion_Star_28KG_Brushless-D-main-3.jpg?v=1770808177",
   "image_source": "AI2FitLab / OpenELab 商城商品页归档 商品图",
   "motor_type": "Brushless Motor",
   "tau_stall_Nm": 28.0,
   "temp_range": "-10 ~ 60°C",
   "i_stall_A": 5.5,
   "resolution": "4096 [steps/360°]",
   "comm": "UART/TTL",
   "dims": "40×40×20mm",
   "tau_basis": null
  }
 },
 {
  "category": "actuator",
  "subtype": "servo",
  "id": "fashion-star-fashion-star-hx8-r29h-m-rs485-bus-servo",
  "vendor": "Fashion Star",
  "model": "Fashion Star HX8-R29H-M RS485 Bus Servo",
  "title": "Fashion Star HX8-R29H-M RS485 Bus Servo",
  "url": "https://aifitlab.com/products/fashion-star-hx8-r29h-m-rs485-bus-servo",
  "source_tier": "B",
  "verified": false,
  "last_checked": "2026-10-28",
  "price_cny": 195.0,
  "origin": "AI2FitLab / OpenELab 商城商品页归档（2026-10-28 抓取）",
  "notes": "仅公布堵转扭矩，未公布峰值（堵转 ≠ 峰值，不互相顶替）",
  "specs": {
   "tau_peak_Nm": null,
   "tau_rated_Nm": null,
   "gear": 173.0,
   "speed_noload_rpm": 142.0,
   "mass_kg": 0.095,
   "armature_kgm2": null,
   "voltage_V": null,
   "kt_Nm_per_A": null,
   "image_url": "https://cdn.shopify.com/s/files/1/0673/6848/5000/files/Fashion_Star_HX8-R29H-M_main-2.jpg?v=1770867060",
   "image_source": "AI2FitLab / OpenELab 商城商品页归档 商品图",
   "motor_type": "Brushless Motor",
   "tau_stall_Nm": 28.0,
   "temp_range": "-10 ~ 60°C",
   "i_stall_A": 5.5,
   "resolution": "4096 [steps/360°]",
   "comm": "RS-485",
   "dims": "40×20×46mm",
   "tau_basis": null
  }
 },
 {
  "category": "actuator",
  "subtype": "servo",
  "id": "fashion-star-fashion-star-hx8-r28h-m-rs485-bus-servo",
  "vendor": "Fashion Star",
  "model": "Fashion Star HX8-R28H-M RS485 Bus Servo",
  "title": "Fashion Star HX8-R28H-M RS485 Bus Servo",
  "url": "https://aifitlab.com/products/fashion-star-hx8-r28h-m-rs485-bus-servo",
  "source_tier": "B",
  "verified": false,
  "last_checked": "2026-10-28",
  "price_cny": 165.0,
  "origin": "AI2FitLab / OpenELab 商城商品页归档（2026-10-28 抓取）",
  "notes": "仅公布堵转扭矩，未公布峰值（堵转 ≠ 峰值，不互相顶替）",
  "specs": {
   "tau_peak_Nm": null,
   "tau_rated_Nm": null,
   "gear": 173.0,
   "speed_noload_rpm": 142.0,
   "mass_kg": 0.095,
   "armature_kgm2": null,
   "voltage_V": null,
   "kt_Nm_per_A": null,
   "image_url": "https://cdn.shopify.com/s/files/1/0673/6848/5000/files/Fashion_Star_RS485_28KG_main-3.jpg?v=1770864122",
   "image_source": "AI2FitLab / OpenELab 商城商品页归档 商品图",
   "motor_type": "Brushless Motor",
   "tau_stall_Nm": 28.0,
   "temp_range": "-10 ~ 60°C",
   "i_stall_A": 5.5,
   "resolution": "4096 [steps/360°]",
   "comm": "RS-485",
   "dims": "40×20×46mm",
   "tau_basis": null
  }
 },
 {
  "category": "actuator",
  "subtype": "servo",
  "id": "fashion-star-fashion-star-hx8-u28h-m-uart-bus-servo",
  "vendor": "Fashion Star",
  "model": "Fashion Star HX8-U28H-M UART Bus Servo",
  "title": "Fashion Star HX8-U28H-M UART Bus Servo",
  "url": "https://aifitlab.com/products/fashion-star-hx8-u28h-m-uart-bus-servo",
  "source_tier": "B",
  "verified": false,
  "last_checked": "2026-10-28",
  "price_cny": 165.0,
  "origin": "AI2FitLab / OpenELab 商城商品页归档（2026-10-28 抓取）",
  "notes": "仅公布堵转扭矩，未公布峰值（堵转 ≠ 峰值，不互相顶替）",
  "specs": {
   "tau_peak_Nm": null,
   "tau_rated_Nm": null,
   "gear": 173.0,
   "speed_noload_rpm": 150.0,
   "mass_kg": 0.083,
   "armature_kgm2": null,
   "voltage_V": 12.6,
   "kt_Nm_per_A": null,
   "image_url": "https://cdn.shopify.com/s/files/1/0673/6848/5000/files/Fashion_Star_28KG_Brushless-main-3.jpg?v=1770619857",
   "image_source": "AI2FitLab / OpenELab 商城商品页归档 商品图",
   "motor_type": "Brushless Motor",
   "tau_stall_Nm": 28.0,
   "temp_range": "-10 ~ 60°C",
   "i_stall_A": 5.5,
   "resolution": "4096 [steps/360°]",
   "comm": "UART/TTL",
   "dims": "40×40×20mm",
   "tau_basis": null
  }
 },
 {
  "category": "actuator",
  "subtype": "servo",
  "id": "fashion-star-fashion-star-hp8-u45h-m-uart-bus-servo",
  "vendor": "Fashion Star",
  "model": "Fashion Star HP8-U45H-M UART Bus Servo",
  "title": "Fashion Star HP8-U45H-M UART Bus Servo",
  "url": "https://aifitlab.com/products/fashion-star-hp8-u45h-m-uart-bus-servo",
  "source_tier": "B",
  "verified": false,
  "last_checked": "2026-10-28",
  "price_cny": 70.0,
  "origin": "AI2FitLab / OpenELab 商城商品页归档（2026-10-28 抓取）",
  "notes": "仅公布堵转扭矩，未公布峰值（堵转 ≠ 峰值，不互相顶替）",
  "specs": {
   "tau_peak_Nm": null,
   "tau_rated_Nm": null,
   "gear": 273.0,
   "speed_noload_rpm": 118.0,
   "mass_kg": 0.073,
   "armature_kgm2": null,
   "voltage_V": 12.6,
   "kt_Nm_per_A": null,
   "image_url": "https://cdn.shopify.com/s/files/1/0673/6848/5000/files/Fashion_Star_Servo_45KG-main-4.jpg?v=1770528891",
   "image_source": "AI2FitLab / OpenELab 商城商品页归档 商品图",
   "motor_type": "Coreless",
   "tau_stall_Nm": 45.0,
   "temp_range": "-10 ~ 60℃",
   "i_stall_A": 6.0,
   "resolution": "4096 [steps/360°]",
   "comm": "UART/TTL",
   "dims": "40×40×20mm",
   "tau_basis": null
  }
 },
 {
  "category": "actuator",
  "subtype": "servo",
  "id": "fashion-star-fashion-star-hp6-u15h-m-uart-bus-servo",
  "vendor": "Fashion Star",
  "model": "Fashion Star HP6-U15H-M UART Bus Servo",
  "title": "Fashion Star HP6-U15H-M UART Bus Servo",
  "url": "https://aifitlab.com/products/fashion-star-hp6-u15h-m-uart-bus-servo",
  "source_tier": "B",
  "verified": false,
  "last_checked": "2026-10-28",
  "price_cny": 70.0,
  "origin": "AI2FitLab / OpenELab 商城商品页归档（2026-10-28 抓取）",
  "notes": "仅公布堵转扭矩，未公布峰值（堵转 ≠ 峰值，不互相顶替）",
  "specs": {
   "tau_peak_Nm": null,
   "tau_rated_Nm": null,
   "gear": 257.0,
   "speed_noload_rpm": 100.0,
   "mass_kg": 0.041,
   "armature_kgm2": null,
   "voltage_V": 12.6,
   "kt_Nm_per_A": null,
   "image_url": "https://cdn.shopify.com/s/files/1/0673/6848/5000/files/Fashion_Star_Servo_15KG-main-3.jpg?v=1770538168",
   "image_source": "AI2FitLab / OpenELab 商城商品页归档 商品图",
   "motor_type": "Coreless",
   "tau_stall_Nm": 15.0,
   "temp_range": "-10 ~ 60°C",
   "i_stall_A": 2.0,
   "resolution": "4096 [steps/360°]",
   "comm": "UART/TTL",
   "dims": "31.5×21×27.6mm",
   "tau_basis": null
  }
 },
 {
  "category": "actuator",
  "subtype": "servo",
  "id": "fashion-star-fashion-star-rp8-a45-digital-servo",
  "vendor": "Fashion Star",
  "model": "Fashion Star RP8-A45 Digital Servo",
  "title": "Fashion Star RP8-A45 Digital Servo",
  "url": "https://aifitlab.com/products/fashion-star-rp8-a45-digital-servo",
  "source_tier": "B",
  "verified": false,
  "last_checked": "2026-10-28",
  "price_cny": 55.0,
  "origin": "AI2FitLab / OpenELab 商城商品页归档（2026-10-28 抓取）",
  "notes": "仅公布堵转扭矩，未公布峰值（堵转 ≠ 峰值，不互相顶替）",
  "specs": {
   "tau_peak_Nm": null,
   "tau_rated_Nm": null,
   "gear": 273.0,
   "speed_noload_rpm": null,
   "mass_kg": 0.073,
   "armature_kgm2": null,
   "voltage_V": 8.4,
   "kt_Nm_per_A": null,
   "image_url": "https://cdn.shopify.com/s/files/1/0673/6848/5000/files/Fashion_Star_RP8-P45_main-3.jpg?v=1770890914",
   "image_source": "AI2FitLab / OpenELab 商城商品页归档 商品图",
   "motor_type": "Iron Core",
   "tau_stall_Nm": 45.0,
   "i_stall_A": 6.0,
   "dims": "40×40×20mm",
   "tau_basis": null
  }
 },
 {
  "category": "actuator",
  "subtype": "servo",
  "id": "fashion-star-fashion-star-ha8-u25-m-uart-bus-servo",
  "vendor": "Fashion Star",
  "model": "Fashion Star HA8-U25-M UART Bus Servo",
  "title": "Fashion Star HA8-U25-M UART Bus Servo",
  "url": "https://aifitlab.com/products/fashion-star-ha8-u25-m-uart-bus-servo",
  "source_tier": "B",
  "verified": false,
  "last_checked": "2026-10-28",
  "price_cny": 30.0,
  "origin": "AI2FitLab / OpenELab 商城商品页归档（2026-10-28 抓取）",
  "notes": "仅公布堵转扭矩，未公布峰值（堵转 ≠ 峰值，不互相顶替）",
  "specs": {
   "tau_peak_Nm": null,
   "tau_rated_Nm": null,
   "gear": 273.0,
   "speed_noload_rpm": 72.0,
   "mass_kg": 0.063,
   "armature_kgm2": null,
   "voltage_V": 8.4,
   "kt_Nm_per_A": null,
   "image_url": "https://cdn.shopify.com/s/files/1/0673/6848/5000/files/Fashion_Star_UART_Bus_Servo-25KG_main_4.jpg?v=1770385137",
   "image_source": "AI2FitLab / OpenELab 商城商品页归档 商品图",
   "motor_type": "Iron Core",
   "tau_stall_Nm": 25.0,
   "temp_range": "-10 ~ 60℃",
   "i_stall_A": 3.0,
   "resolution": "2048 [steps/360°]",
   "comm": "UART/TTL",
   "dims": "40×40×20mm",
   "tau_basis": null
  }
 },
 {
  "category": "actuator",
  "subtype": "servo",
  "id": "fashion-star-fashion-star-ra8-p25-digital-servo",
  "vendor": "Fashion Star",
  "model": "Fashion Star RA8-P25 Digital Servo",
  "title": "Fashion Star RA8-P25 Digital Servo",
  "url": "https://aifitlab.com/products/fashion-star-ra8-p25-digital-servo",
  "source_tier": "B",
  "verified": false,
  "last_checked": "2026-10-28",
  "price_cny": 20.0,
  "origin": "AI2FitLab / OpenELab 商城商品页归档（2026-10-28 抓取）",
  "notes": "仅公布堵转扭矩，未公布峰值（堵转 ≠ 峰值，不互相顶替）",
  "specs": {
   "tau_peak_Nm": null,
   "tau_rated_Nm": null,
   "gear": 273.0,
   "speed_noload_rpm": null,
   "mass_kg": 0.064,
   "armature_kgm2": null,
   "voltage_V": 8.4,
   "kt_Nm_per_A": null,
   "image_url": "https://cdn.shopify.com/s/files/1/0673/6848/5000/files/Fashion_Star_HA8-P25_main-3.jpg?v=1770888504",
   "image_source": "AI2FitLab / OpenELab 商城商品页归档 商品图",
   "motor_type": "Iron Core",
   "tau_stall_Nm": 25.0,
   "i_stall_A": 3.0,
   "dims": "40×40×20mm",
   "tau_basis": null
  }
 }
]
