[
 {
  "category": "module",
  "subtype": "servo",
  "id": "choho-choho-hand",
  "vendor": "CHOHO",
  "model": "CHOHO Hand",
  "title": "CHOHO Hand",
  "url": "https://aifitlab.com/products/choho-hand",
  "source_tier": "B",
  "verified": false,
  "last_checked": "2026-10-28",
  "price_cny": 16080.0,
  "origin": "AI2FitLab / OpenELab 商城商品页归档（2026-10-28 抓取）",
  "notes": "",
  "specs": {
   "tau_peak_Nm": null,
   "tau_rated_Nm": null,
   "gear": null,
   "speed_noload_rpm": null,
   "mass_kg": null,
   "armature_kgm2": null,
   "voltage_V": null,
   "kt_Nm_per_A": null,
   "image_url": "https://cdn.shopify.com/s/files/1/0673/6848/5000/files/CHOHO_ROBOT-Robotic_Hand-main-0.jpg?v=1780746030",
   "image_source": "AI2FitLab / OpenELab 商城商品页归档 商品图",
   "temp_range": "-20°C ~ 60°C (wider range with different housing materials)",
   "comm": "EtherCAT / CAN",
   "tau_basis": null
  }
 }
]
