[
 {
  "category": "lidar",
  "subtype": "servo",
  "id": "skylandx-skylandx-metacam-air2-lidar-scanner",
  "vendor": "SkylandX",
  "model": "SkylandX MetaCam Air2 LiDAR Scanner",
  "title": "SkylandX MetaCam Air2 LiDAR Scanner",
  "url": "https://aifitlab.com/products/skylandx-metacam-air2-lidar-scanner",
  "source_tier": "B",
  "verified": false,
  "last_checked": "2026-10-28",
  "price_cny": 5000.0,
  "origin": "AI2FitLab / OpenELab 商城商品页归档（2026-10-28 抓取）",
  "notes": "",
  "specs": {
   "tau_peak_Nm": null,
   "tau_rated_Nm": null,
   "gear": null,
   "speed_noload_rpm": null,
   "mass_kg": 0.68,
   "armature_kgm2": null,
   "voltage_V": 14.4,
   "kt_Nm_per_A": null,
   "image_url": "https://cdn.shopify.com/s/files/1/0673/6848/5000/files/SkylandX-MetaCam_Air2-main-1_ddc4ed97-12a1-4394-9137-63e70800b220.jpg?v=1781869193",
   "image_source": "AI2FitLab / OpenELab 商城商品页归档 商品图",
   "dims": "298*105*104mm, 133*105*104mm",
   "temp_range": "-20°C ~ 55°C",
   "tau_basis": null
  }
 },
 {
  "category": "lidar",
  "subtype": "servo",
  "id": "skylandx-skylandx-c01-lidar",
  "vendor": "SkylandX",
  "model": "SkylandX C01 LiDAR",
  "title": "SkylandX C01 LiDAR",
  "url": "https://aifitlab.com/products/skylandx-c01-lidar",
  "source_tier": "B",
  "verified": false,
  "last_checked": "2026-10-28",
  "price_cny": 600.0,
  "origin": "AI2FitLab / OpenELab 商城商品页归档（2026-10-28 抓取）",
  "notes": "",
  "specs": {
   "tau_peak_Nm": null,
   "tau_rated_Nm": null,
   "gear": null,
   "speed_noload_rpm": null,
   "mass_kg": 0.42,
   "armature_kgm2": null,
   "voltage_V": 12.0,
   "kt_Nm_per_A": null,
   "image_url": "https://cdn.shopify.com/s/files/1/0673/6848/5000/files/SkylandX-C01-main-1.jpg?v=1781851838",
   "image_source": "AI2FitLab / OpenELab 商城商品页归档 商品图",
   "comm": "UDP",
   "temp_range": "-20°C ~ 55°C",
   "power_w": 15.0,
   "dims": "73(L) × 73.75(W) × 77.8(H) mm",
   "tau_basis": null
  }
 }
]
