[
 {
  "category": "module",
  "subtype": "servo",
  "id": "haptron-scientific-haptron-scientific-photon-finger-5in1-sensor",
  "vendor": "Haptron Scientific",
  "model": "Haptron Scientific Photon Finger 5in1 Sensor",
  "title": "Haptron Scientific Photon Finger 5in1 Sensor",
  "url": "https://aifitlab.com/products/haptron-scientific-photon-finger-5in1-sensor",
  "source_tier": "B",
  "verified": false,
  "last_checked": "2026-10-28",
  "price_cny": 7800.0,
  "origin": "AI2FitLab / OpenELab 商城商品页归档（2026-10-28 抓取）",
  "notes": "",
  "specs": {
   "tau_peak_Nm": null,
   "tau_rated_Nm": null,
   "gear": null,
   "speed_noload_rpm": null,
   "mass_kg": null,
   "armature_kgm2": null,
   "voltage_V": null,
   "kt_Nm_per_A": null,
   "image_url": "https://cdn.shopify.com/s/files/1/0673/6848/5000/files/Haptron_Scientific-Photon_Finger_5in1-main-2.jpg?v=1763425793",
   "image_source": "AI2FitLab / OpenELab 商城商品页归档 商品图",
   "dims": "D8.5*7mm",
   "resolution": "0.05N",
   "tau_basis": null
  }
 },
 {
  "category": "module",
  "subtype": "servo",
  "id": "haptron-scientific-haptron-scientific-photon-micro-3x-sensor",
  "vendor": "Haptron Scientific",
  "model": "Haptron Scientific Photon micro 3X Sensor",
  "title": "Haptron Scientific Photon micro 3X Sensor",
  "url": "https://aifitlab.com/products/haptron-scientific-photon-micro-3x-sensor",
  "source_tier": "B",
  "verified": false,
  "last_checked": "2026-10-28",
  "price_cny": 7500.0,
  "origin": "AI2FitLab / OpenELab 商城商品页归档（2026-10-28 抓取）",
  "notes": "",
  "specs": {
   "tau_peak_Nm": null,
   "tau_rated_Nm": null,
   "gear": null,
   "speed_noload_rpm": null,
   "mass_kg": null,
   "armature_kgm2": null,
   "voltage_V": null,
   "kt_Nm_per_A": null,
   "image_url": "https://cdn.shopify.com/s/files/1/0673/6848/5000/files/Haptron_Scientific-Photon_micio_3X-main-1.jpg?v=1763464630",
   "image_source": "AI2FitLab / OpenELab 商城商品页归档 商品图",
   "resolution": "0.05N",
   "temp_range": "-10℃～ 50℃",
   "comm": "USB (Other interfaces customizable)",
   "tau_basis": null
  }
 },
 {
  "category": "module",
  "subtype": "servo",
  "id": "haptron-scientific-haptron-scientific-photon-r15-sensor",
  "vendor": "Haptron Scientific",
  "model": "Haptron Scientific Photon R15 Sensor",
  "title": "Haptron Scientific Photon R15 Sensor",
  "url": "https://aifitlab.com/products/haptron-scientific-photon-r15-sensor",
  "source_tier": "B",
  "verified": false,
  "last_checked": "2026-10-28",
  "price_cny": 7500.0,
  "origin": "AI2FitLab / OpenELab 商城商品页归档（2026-10-28 抓取）",
  "notes": "",
  "specs": {
   "tau_peak_Nm": null,
   "tau_rated_Nm": null,
   "gear": null,
   "speed_noload_rpm": null,
   "mass_kg": null,
   "armature_kgm2": null,
   "voltage_V": 5.0,
   "kt_Nm_per_A": null,
   "image_url": "https://cdn.shopify.com/s/files/1/0673/6848/5000/files/Haptron_Scientific-Photon_R15-main-1.jpg?v=1763542819",
   "image_source": "AI2FitLab / OpenELab 商城商品页归档 商品图",
   "temp_range": "-10℃～ 50℃",
   "comm": "RS485",
   "tau_basis": null
  }
 },
 {
  "category": "module",
  "subtype": "servo",
  "id": "haptron-scientific-haptron-scientific-photon-r40-sensor",
  "vendor": "Haptron Scientific",
  "model": "Haptron Scientific Photon R40 Sensor",
  "title": "Haptron Scientific Photon R40 Sensor",
  "url": "https://aifitlab.com/products/haptron-scientific-photon-r40-sensor",
  "source_tier": "B",
  "verified": false,
  "last_checked": "2026-10-28",
  "price_cny": 4800.0,
  "origin": "AI2FitLab / OpenELab 商城商品页归档（2026-10-28 抓取）",
  "notes": "",
  "specs": {
   "tau_peak_Nm": null,
   "tau_rated_Nm": null,
   "gear": null,
   "speed_noload_rpm": null,
   "mass_kg": null,
   "armature_kgm2": null,
   "voltage_V": null,
   "kt_Nm_per_A": null,
   "image_url": "https://cdn.shopify.com/s/files/1/0673/6848/5000/files/Haptron_Scientific-Photon_R40-main-1.jpg?v=1763542824",
   "image_source": "AI2FitLab / OpenELab 商城商品页归档 商品图",
   "resolution": "1N",
   "temp_range": "-10℃～ 70℃",
   "comm": "RS485/EtherCAT",
   "tau_basis": null
  }
 },
 {
  "category": "module",
  "subtype": "servo",
  "id": "haptron-scientific-haptron-scientific-photon-r75-sensor",
  "vendor": "Haptron Scientific",
  "model": "Haptron Scientific Photon R75 Sensor",
  "title": "Haptron Scientific Photon R75 Sensor",
  "url": "https://aifitlab.com/products/haptron-scientific-photon-r75-sensor",
  "source_tier": "B",
  "verified": false,
  "last_checked": "2026-10-28",
  "price_cny": 3200.0,
  "origin": "AI2FitLab / OpenELab 商城商品页归档（2026-10-28 抓取）",
  "notes": "",
  "specs": {
   "tau_peak_Nm": null,
   "tau_rated_Nm": null,
   "gear": null,
   "speed_noload_rpm": null,
   "mass_kg": null,
   "armature_kgm2": null,
   "voltage_V": 24.0,
   "kt_Nm_per_A": null,
   "image_url": "https://cdn.shopify.com/s/files/1/0673/6848/5000/files/Haptron_Scientific-Photon_R75-main-2.jpg?v=1763605072",
   "image_source": "AI2FitLab / OpenELab 商城商品页归档 商品图",
   "temp_range": "-20℃～ 80℃",
   "comm": "RS485/RS422",
   "tau_basis": null
  }
 },
 {
  "category": "module",
  "subtype": "servo",
  "id": "haptron-scientific-haptron-scientific-photon-finger-b-sensor",
  "vendor": "Haptron Scientific",
  "model": "Haptron Scientific Photon Finger B Sensor",
  "title": "Haptron Scientific Photon Finger B Sensor",
  "url": "https://aifitlab.com/products/haptron-scientific-photon-finger-b-sensor",
  "source_tier": "B",
  "verified": false,
  "last_checked": "2026-10-28",
  "price_cny": 2000.0,
  "origin": "AI2FitLab / OpenELab 商城商品页归档（2026-10-28 抓取）",
  "notes": "",
  "specs": {
   "tau_peak_Nm": null,
   "tau_rated_Nm": null,
   "gear": null,
   "speed_noload_rpm": null,
   "mass_kg": null,
   "armature_kgm2": null,
   "voltage_V": null,
   "kt_Nm_per_A": null,
   "image_url": "https://cdn.shopify.com/s/files/1/0673/6848/5000/files/Haptron_Scientific-Photon_Finger_B-main-1.jpg?v=1763424425",
   "image_source": "AI2FitLab / OpenELab 商城商品页归档 商品图",
   "resolution": "0.05N",
   "temp_range": "-10℃～ 50℃",
   "comm": "USB (Other interfaces customizable)",
   "tau_basis": null
  }
 }
]
