[
 {
  "category": "lidar",
  "subtype": "servo",
  "id": "3dmakerpro-3dmakerpro-eagle-lidar-scanner",
  "vendor": "3DMAKERPRO",
  "model": "3DMakerpro Eagle LiDAR Scanner",
  "title": "3DMakerpro Eagle LiDAR Scanner",
  "url": "https://aifitlab.com/products/3dmakerpro-eagle-lidar-scanner",
  "source_tier": "B",
  "verified": false,
  "last_checked": "2026-10-28",
  "price_cny": 3998.0,
  "origin": "AI2FitLab / OpenELab 商城商品页归档（2026-10-28 抓取）",
  "notes": "",
  "specs": {
   "tau_peak_Nm": null,
   "tau_rated_Nm": null,
   "gear": null,
   "speed_noload_rpm": null,
   "mass_kg": 1.5,
   "armature_kgm2": null,
   "voltage_V": null,
   "kt_Nm_per_A": null,
   "image_url": "https://cdn.shopify.com/s/files/1/0673/6848/5000/files/3DMAKERPRO-Eagle-main-4.jpg?v=1775931534",
   "image_source": "AI2FitLab / OpenELab 商城商品页归档 商品图",
   "accuracy": "2 cm @ 10 m; 3 cm @ 20 m; 5 cm @ 40 m",
   "dims": "115 × 181 × 106 mm",
   "tau_basis": null
  }
 },
 {
  "category": "lidar",
  "subtype": "servo",
  "id": "3dmakerpro-3dmakerpro-raven-lidar-scanner",
  "vendor": "3DMAKERPRO",
  "model": "3DMakerpro Raven LiDAR Scanner",
  "title": "3DMakerpro Raven LiDAR Scanner",
  "url": "https://aifitlab.com/products/3dmakerpro-raven-lidar-scanner",
  "source_tier": "B",
  "verified": false,
  "last_checked": "2026-10-28",
  "price_cny": 1699.0,
  "origin": "AI2FitLab / OpenELab 商城商品页归档（2026-10-28 抓取）",
  "notes": "",
  "specs": {
   "tau_peak_Nm": null,
   "tau_rated_Nm": null,
   "gear": null,
   "speed_noload_rpm": null,
   "mass_kg": 1.1,
   "armature_kgm2": null,
   "voltage_V": null,
   "kt_Nm_per_A": null,
   "image_url": "https://cdn.shopify.com/s/files/1/0673/6848/5000/files/3DMAKERPRO-Raven-main-2.jpg?v=1775901880",
   "image_source": "AI2FitLab / OpenELab 商城商品页归档 商品图",
   "accuracy": "2cm @ 10m, 3cm @ 20m, 5cm @ 40m",
   "tau_basis": null
  }
 }
]
