[
 {
  "category": "module",
  "subtype": "servo",
  "id": "bwsensing-bwsensing-bw-mins500-sensor",
  "vendor": "BWSENSING",
  "model": "BWSENSING BW-MINS500 Sensor",
  "title": "BWSENSING BW-MINS500 Sensor",
  "url": "https://aifitlab.com/products/bwsensing-bw-mins500-sensor",
  "source_tier": "B",
  "verified": false,
  "last_checked": "2026-10-28",
  "price_cny": 2105.0,
  "origin": "AI2FitLab / OpenELab 商城商品页归档（2026-10-28 抓取）",
  "notes": "",
  "specs": {
   "tau_peak_Nm": null,
   "tau_rated_Nm": null,
   "gear": null,
   "speed_noload_rpm": null,
   "mass_kg": null,
   "armature_kgm2": null,
   "voltage_V": null,
   "kt_Nm_per_A": null,
   "image_url": "https://cdn.shopify.com/s/files/1/0673/6848/5000/files/MINS500-main-2.png?v=1756829337",
   "image_source": "AI2FitLab / OpenELab 商城商品页归档 商品图",
   "temp_range": "-40~85℃",
   "meas_range": "0.1°/min",
   "resolution": "0.01°/sec",
   "tau_basis": null
  }
 },
 {
  "category": "module",
  "subtype": "servo",
  "id": "bwsensing-bwsensing-dmc620-sensor",
  "vendor": "BWSENSING",
  "model": "BWSENSING DMC620 Sensor",
  "title": "BWSENSING DMC620 Sensor",
  "url": "https://aifitlab.com/products/bwsensing-dmc620-sensor",
  "source_tier": "B",
  "verified": false,
  "last_checked": "2026-10-28",
  "price_cny": 395.0,
  "origin": "AI2FitLab / OpenELab 商城商品页归档（2026-10-28 抓取）",
  "notes": "",
  "specs": {
   "tau_peak_Nm": null,
   "tau_rated_Nm": null,
   "gear": null,
   "speed_noload_rpm": null,
   "mass_kg": null,
   "armature_kgm2": null,
   "voltage_V": null,
   "kt_Nm_per_A": null,
   "image_url": "https://cdn.shopify.com/s/files/1/0673/6848/5000/files/DMC620-main-2.jpg?v=1760783122",
   "image_source": "AI2FitLab / OpenELab 商城商品页归档 商品图",
   "temp_range": "-40°C~+85°C",
   "tau_basis": null
  }
 },
 {
  "category": "module",
  "subtype": "servo",
  "id": "bwsensing-bwsensing-bw-imu127c-sensor",
  "vendor": "BWSENSING",
  "model": "BWSENSING BW-IMU127C Sensor",
  "title": "BWSENSING BW-IMU127C Sensor",
  "url": "https://aifitlab.com/products/bwsensing-bw-imu127c-sensor",
  "source_tier": "B",
  "verified": false,
  "last_checked": "2026-10-28",
  "price_cny": 340.0,
  "origin": "AI2FitLab / OpenELab 商城商品页归档（2026-10-28 抓取）",
  "notes": "",
  "specs": {
   "tau_peak_Nm": null,
   "tau_rated_Nm": null,
   "gear": null,
   "speed_noload_rpm": null,
   "mass_kg": null,
   "armature_kgm2": null,
   "voltage_V": null,
   "kt_Nm_per_A": null,
   "image_url": "https://cdn.shopify.com/s/files/1/0673/6848/5000/files/IMU127C-main-4.png?v=1756823630",
   "image_source": "AI2FitLab / OpenELab 商城商品页归档 商品图",
   "temp_range": "-40°C~+85°C",
   "resolution": "0.01°/sec",
   "tau_basis": null
  }
 },
 {
  "category": "module",
  "subtype": "servo",
  "id": "bwsensing-bwsensing-dmc630-sensor",
  "vendor": "BWSENSING",
  "model": "BWSENSING DMC630 Sensor",
  "title": "BWSENSING DMC630 Sensor",
  "url": "https://aifitlab.com/products/bwsensing-dmc630-sensor",
  "source_tier": "B",
  "verified": false,
  "last_checked": "2026-10-28",
  "price_cny": 290.0,
  "origin": "AI2FitLab / OpenELab 商城商品页归档（2026-10-28 抓取）",
  "notes": "",
  "specs": {
   "tau_peak_Nm": null,
   "tau_rated_Nm": null,
   "gear": null,
   "speed_noload_rpm": null,
   "mass_kg": null,
   "armature_kgm2": null,
   "voltage_V": null,
   "kt_Nm_per_A": null,
   "image_url": "https://cdn.shopify.com/s/files/1/0673/6848/5000/files/DMC630-main-1.jpg?v=1756115048",
   "image_source": "AI2FitLab / OpenELab 商城商品页归档 商品图",
   "temp_range": "-40°C~+85°C",
   "tau_basis": null
  }
 },
 {
  "category": "module",
  "subtype": "servo",
  "id": "bwsensing-bwsensing-bw-vg55r-sensor",
  "vendor": "BWSENSING",
  "model": "BWSENSING BW-VG55R Sensor",
  "title": "BWSENSING BW-VG55R Sensor",
  "url": "https://aifitlab.com/products/bwsensing-bw-vg55r-sensor",
  "source_tier": "B",
  "verified": false,
  "last_checked": "2026-10-28",
  "price_cny": 260.0,
  "origin": "AI2FitLab / OpenELab 商城商品页归档（2026-10-28 抓取）",
  "notes": "",
  "specs": {
   "tau_peak_Nm": null,
   "tau_rated_Nm": null,
   "gear": null,
   "speed_noload_rpm": null,
   "mass_kg": null,
   "armature_kgm2": null,
   "voltage_V": null,
   "kt_Nm_per_A": null,
   "image_url": "https://cdn.shopify.com/s/files/1/0673/6848/5000/files/VG55R-main-1.jpg?v=1756111889",
   "image_source": "AI2FitLab / OpenELab 商城商品页归档 商品图",
   "temp_range": "-40~+80℃",
   "resolution": "0.01°",
   "dims": "L70*W80*H27.9(mm)",
   "tau_basis": null
  }
 },
 {
  "category": "module",
  "subtype": "servo",
  "id": "bwsensing-bwsensing-bw-vg100-sensor",
  "vendor": "BWSENSING",
  "model": "BWSENSING BW-VG100 Sensor",
  "title": "BWSENSING BW-VG100 Sensor",
  "url": "https://aifitlab.com/products/bwsensing-bw-vg100-sensor",
  "source_tier": "B",
  "verified": false,
  "last_checked": "2026-10-28",
  "price_cny": 205.0,
  "origin": "AI2FitLab / OpenELab 商城商品页归档（2026-10-28 抓取）",
  "notes": "",
  "specs": {
   "tau_peak_Nm": null,
   "tau_rated_Nm": null,
   "gear": null,
   "speed_noload_rpm": null,
   "mass_kg": null,
   "armature_kgm2": null,
   "voltage_V": null,
   "kt_Nm_per_A": null,
   "image_url": "https://cdn.shopify.com/s/files/1/0673/6848/5000/files/BW-VG100-main-3.png?v=1756825165",
   "image_source": "AI2FitLab / OpenELab 商城商品页归档 商品图",
   "temp_range": "-40°C~85°C",
   "resolution": "0.01°",
   "dims": "L55 x W37 x H24 (mm)",
   "tau_basis": null
  }
 },
 {
  "category": "module",
  "subtype": "servo",
  "id": "bwsensing-bwsensing-dmc640-sensor",
  "vendor": "BWSENSING",
  "model": "BWSENSING DMC640 Sensor",
  "title": "BWSENSING DMC640 Sensor",
  "url": "https://aifitlab.com/products/bwsensing-dmc640-sensor",
  "source_tier": "B",
  "verified": false,
  "last_checked": "2026-10-28",
  "price_cny": 155.0,
  "origin": "AI2FitLab / OpenELab 商城商品页归档（2026-10-28 抓取）",
  "notes": "",
  "specs": {
   "tau_peak_Nm": null,
   "tau_rated_Nm": null,
   "gear": null,
   "speed_noload_rpm": null,
   "mass_kg": null,
   "armature_kgm2": null,
   "voltage_V": null,
   "kt_Nm_per_A": null,
   "image_url": "https://cdn.shopify.com/s/files/1/0673/6848/5000/files/DMC640-main-1.jpg?v=1760783970",
   "image_source": "AI2FitLab / OpenELab 商城商品页归档 商品图",
   "temp_range": "-40°C~+85°C",
   "tau_basis": null
  }
 },
 {
  "category": "module",
  "subtype": "servo",
  "id": "bwsensing-bwsensing-bwn426s-dual-axis-inclinometer-sensor",
  "vendor": "BWSENSING",
  "model": "BWSENSING BWN426S Dual-Axis Inclinometer Sensor",
  "title": "BWSENSING BWN426S Dual-Axis Inclinometer Sensor",
  "url": "https://aifitlab.com/products/bwsensing-bwn426s-dual-axis-inclinometer-sensor",
  "source_tier": "B",
  "verified": false,
  "last_checked": "2026-10-28",
  "price_cny": 126.0,
  "origin": "AI2FitLab / OpenELab 商城商品页归档（2026-10-28 抓取）",
  "notes": "",
  "specs": {
   "tau_peak_Nm": null,
   "tau_rated_Nm": null,
   "gear": null,
   "speed_noload_rpm": null,
   "mass_kg": null,
   "armature_kgm2": null,
   "voltage_V": null,
   "kt_Nm_per_A": null,
   "image_url": "https://cdn.shopify.com/s/files/1/0673/6848/5000/files/BWN426S-main-1.jpg?v=1756844443",
   "image_source": "AI2FitLab / OpenELab 商城商品页归档 商品图",
   "temp_range": "-40°C~+85°C",
   "accuracy": "0.02°",
   "resolution": "0.001°",
   "tau_basis": null
  }
 },
 {
  "category": "module",
  "subtype": "servo",
  "id": "bwsensing-bwsensing-bw-imu50-sensor",
  "vendor": "BWSENSING",
  "model": "BWSENSING BW-IMU50 Sensor",
  "title": "BWSENSING BW-IMU50 Sensor",
  "url": "https://aifitlab.com/products/bwsensing-bw-imu50-sensor",
  "source_tier": "B",
  "verified": false,
  "last_checked": "2026-10-28",
  "price_cny": 81.0,
  "origin": "AI2FitLab / OpenELab 商城商品页归档（2026-10-28 抓取）",
  "notes": "",
  "specs": {
   "tau_peak_Nm": null,
   "tau_rated_Nm": null,
   "gear": null,
   "speed_noload_rpm": null,
   "mass_kg": null,
   "armature_kgm2": null,
   "voltage_V": null,
   "kt_Nm_per_A": null,
   "image_url": "https://cdn.shopify.com/s/files/1/0673/6848/5000/files/IMU50-main-1.jpg?v=1756891788",
   "image_source": "AI2FitLab / OpenELab 商城商品页归档 商品图",
   "temp_range": "-40°C~+85°C",
   "resolution": "0.01°/sec",
   "tau_basis": null
  }
 },
 {
  "category": "module",
  "subtype": "servo",
  "id": "bwsensing-bwsensing-bwk218-single-axis-inclinometer-sensor",
  "vendor": "BWSENSING",
  "model": "BWSENSING BWK218 Single-Axis Inclinometer Sensor",
  "title": "BWSENSING BWK218 Single-Axis Inclinometer Sensor",
  "url": "https://aifitlab.com/products/bwsensing-bwk218-single-axis-inclinometer-sensor",
  "source_tier": "B",
  "verified": false,
  "last_checked": "2026-10-28",
  "price_cny": 76.0,
  "origin": "AI2FitLab / OpenELab 商城商品页归档（2026-10-28 抓取）",
  "notes": "",
  "specs": {
   "tau_peak_Nm": null,
   "tau_rated_Nm": null,
   "gear": null,
   "speed_noload_rpm": null,
   "mass_kg": 0.23,
   "armature_kgm2": null,
   "voltage_V": null,
   "kt_Nm_per_A": null,
   "image_url": "https://cdn.shopify.com/s/files/1/0673/6848/5000/files/BWK218-main-1.jpg?v=1756811878",
   "image_source": "AI2FitLab / OpenELab 商城商品页归档 商品图",
   "temp_range": "-40°C~+85°C",
   "accuracy": "Indoor 0.2°",
   "resolution": "0.02°",
   "tau_basis": null
  }
 }
]
