[
 {
  "category": "module",
  "subtype": "servo",
  "id": "agilex-agilex-piper-robotic-arm",
  "vendor": "AgileX",
  "model": "AgileX PiPER Robotic Arm",
  "title": "AgileX PiPER Robotic Arm",
  "url": "https://aifitlab.com/products/agilex-piper-robotic-arm",
  "source_tier": "B",
  "verified": false,
  "last_checked": "2026-10-28",
  "price_cny": 25.0,
  "origin": "AI2FitLab / OpenELab 商城商品页归档（2026-10-28 抓取）",
  "notes": "",
  "specs": {
   "tau_peak_Nm": null,
   "tau_rated_Nm": null,
   "gear": null,
   "speed_noload_rpm": null,
   "mass_kg": 4.5,
   "armature_kgm2": null,
   "voltage_V": null,
   "kt_Nm_per_A": null,
   "image_url": "https://cdn.shopify.com/s/files/1/0673/6848/5000/files/AgileX-PiPER-main-2-1.jpg?v=1777789714",
   "image_source": "AI2FitLab / OpenELab 商城商品页归档 商品图",
   "comm": "CAN",
   "tau_basis": null
  }
 },
 {
  "category": "module",
  "subtype": "servo",
  "id": "agilex-agilex-nero-robotic-arm",
  "vendor": "AgileX",
  "model": "AgileX NERO Robotic Arm",
  "title": "AgileX NERO Robotic Arm",
  "url": "https://aifitlab.com/products/agilex-nero-robotic-arm",
  "source_tier": "B",
  "verified": false,
  "last_checked": "2026-10-28",
  "price_cny": 25.0,
  "origin": "AI2FitLab / OpenELab 商城商品页归档（2026-10-28 抓取）",
  "notes": "",
  "specs": {
   "tau_peak_Nm": null,
   "tau_rated_Nm": null,
   "gear": null,
   "speed_noload_rpm": null,
   "mass_kg": 4.8,
   "armature_kgm2": null,
   "voltage_V": null,
   "kt_Nm_per_A": null,
   "image_url": "https://cdn.shopify.com/s/files/1/0673/6848/5000/files/AgileX-NERO-main-4-1.jpg?v=1777997413",
   "image_source": "AI2FitLab / OpenELab 商城商品页归档 商品图",
   "comm": "CAN / TCP / HTTP",
   "tau_basis": null
  }
 }
]
