[
 {
  "category": "camera",
  "subtype": "servo",
  "id": "robosense-robosense-ac1-camera",
  "vendor": "RoboSense",
  "model": "RoboSense AC1 Camera",
  "title": "RoboSense AC1 Camera",
  "url": "https://aifitlab.com/products/robosense-ac1-camera",
  "source_tier": "B",
  "verified": false,
  "last_checked": "2026-10-28",
  "price_cny": 2800.0,
  "origin": "AI2FitLab / OpenELab 商城商品页归档（2026-10-28 抓取）",
  "notes": "",
  "specs": {
   "tau_peak_Nm": null,
   "tau_rated_Nm": null,
   "gear": null,
   "speed_noload_rpm": null,
   "mass_kg": null,
   "armature_kgm2": null,
   "voltage_V": null,
   "kt_Nm_per_A": null,
   "image_url": "https://cdn.shopify.com/s/files/1/0673/6848/5000/files/RoboSense-AC1-main-1.jpg?v=1766485811",
   "image_source": "AI2FitLab / OpenELab 商城商品页归档 商品图",
   "dims": "135×80×40mm",
   "power_w": 11.0,
   "temp_range": "-20℃~+60℃",
   "tau_basis": null
  }
 }
]
