[
 {
  "category": "actuator",
  "subtype": "servo",
  "id": "kingkong-technology-kingkong-ts20-tactile-servo-motor",
  "vendor": "KingKong Technology",
  "model": "KingKong TS20 Tactile Servo Motor",
  "title": "KingKong TS20 Tactile Servo Motor",
  "url": "https://aifitlab.com/products/kingkong-ts20-tactile-servo-motor",
  "source_tier": "B",
  "verified": false,
  "last_checked": "2026-10-28",
  "price_cny": 480.0,
  "origin": "AI2FitLab / OpenELab 商城商品页归档（2026-10-28 抓取）",
  "notes": "",
  "specs": {
   "tau_peak_Nm": null,
   "tau_rated_Nm": 0.7,
   "gear": 50.0,
   "speed_noload_rpm": null,
   "mass_kg": 0.035,
   "armature_kgm2": null,
   "voltage_V": 24.0,
   "kt_Nm_per_A": null,
   "image_url": "https://cdn.shopify.com/s/files/1/0673/6848/5000/files/KingKong_Technology-TS20-main-1.jpg?v=1789192284",
   "image_source": "AI2FitLab / OpenELab 商城商品页归档 商品图",
   "comm": "RS485",
   "tau_basis": null
  }
 }
]
