[
 {
  "category": "module",
  "subtype": "servo",
  "id": "inspire-robots-inspire-robots-rh56e2-robotic-hand",
  "vendor": "INSPIRE-ROBOTS",
  "model": "INSPIRE-ROBOTS RH56E2 Robotic Hand",
  "title": "INSPIRE-ROBOTS RH56E2 Robotic Hand",
  "url": "https://aifitlab.com/products/inspire-robots-rh56e2-robotic-hand",
  "source_tier": "B",
  "verified": false,
  "last_checked": "2026-10-28",
  "price_cny": 10900.0,
  "origin": "AI2FitLab / OpenELab 商城商品页归档（2026-10-28 抓取）",
  "notes": "",
  "specs": {
   "tau_peak_Nm": null,
   "tau_rated_Nm": null,
   "gear": null,
   "speed_noload_rpm": null,
   "mass_kg": 0.01,
   "armature_kgm2": null,
   "voltage_V": 24.0,
   "kt_Nm_per_A": null,
   "image_url": "https://cdn.shopify.com/s/files/1/0673/6848/5000/files/INSPIRE-ROBOTS-RH56E2-main-0.jpg?v=1779024994",
   "image_source": "AI2FitLab / OpenELab 商城商品页归档 商品图",
   "tau_basis": null
  }
 },
 {
  "category": "module",
  "subtype": "servo",
  "id": "inspire-robots-inspire-robots-rh56f1-robotic-hand",
  "vendor": "INSPIRE-ROBOTS",
  "model": "INSPIRE-ROBOTS RH56F1 Robotic Hand",
  "title": "INSPIRE-ROBOTS RH56F1 Robotic Hand",
  "url": "https://aifitlab.com/products/inspire-robots-rh56f1-robotic-hand",
  "source_tier": "B",
  "verified": false,
  "last_checked": "2026-10-28",
  "price_cny": 5500.0,
  "origin": "AI2FitLab / OpenELab 商城商品页归档（2026-10-28 抓取）",
  "notes": "",
  "specs": {
   "tau_peak_Nm": null,
   "tau_rated_Nm": null,
   "gear": null,
   "speed_noload_rpm": null,
   "mass_kg": 0.01,
   "armature_kgm2": null,
   "voltage_V": 24.0,
   "kt_Nm_per_A": null,
   "image_url": "https://cdn.shopify.com/s/files/1/0673/6848/5000/files/INSPIRE-ROBOTS_RH56F1_main_0.jpg?v=1778663534",
   "image_source": "AI2FitLab / OpenELab 商城商品页归档 商品图",
   "i_peak_A": 5.0,
   "tau_basis": null
  }
 },
 {
  "category": "module",
  "subtype": "servo",
  "id": "inspire-robots-inspire-robots-rh56bfx-robotic-hand",
  "vendor": "INSPIRE-ROBOTS",
  "model": "INSPIRE-ROBOTS RH56BFX Robotic Hand",
  "title": "INSPIRE-ROBOTS RH56BFX Robotic Hand",
  "url": "https://aifitlab.com/products/inspire-robots-rh56bfx-robotic-hand",
  "source_tier": "B",
  "verified": false,
  "last_checked": "2026-10-28",
  "price_cny": 4900.0,
  "origin": "AI2FitLab / OpenELab 商城商品页归档（2026-10-28 抓取）",
  "notes": "",
  "specs": {
   "tau_peak_Nm": null,
   "tau_rated_Nm": null,
   "gear": null,
   "speed_noload_rpm": null,
   "mass_kg": 0.54,
   "armature_kgm2": null,
   "voltage_V": 24.0,
   "kt_Nm_per_A": null,
   "image_url": "https://cdn.shopify.com/s/files/1/0673/6848/5000/files/INSPIRE-ROBOTS-RH56BFX-main-0.jpg?v=1779024994",
   "image_source": "AI2FitLab / OpenELab 商城商品页归档 商品图",
   "tau_basis": null
  }
 },
 {
  "category": "module",
  "subtype": "servo",
  "id": "inspire-robots-inspire-robots-rh56dfx-robotic-hand",
  "vendor": "INSPIRE-ROBOTS",
  "model": "INSPIRE-ROBOTS RH56DFX Robotic Hand",
  "title": "INSPIRE-ROBOTS RH56DFX Robotic Hand",
  "url": "https://aifitlab.com/products/inspire-robots-rh56dfx-robotic-hand",
  "source_tier": "B",
  "verified": false,
  "last_checked": "2026-10-28",
  "price_cny": 4900.0,
  "origin": "AI2FitLab / OpenELab 商城商品页归档（2026-10-28 抓取）",
  "notes": "",
  "specs": {
   "tau_peak_Nm": null,
   "tau_rated_Nm": null,
   "gear": null,
   "speed_noload_rpm": null,
   "mass_kg": 0.54,
   "armature_kgm2": null,
   "voltage_V": 24.0,
   "kt_Nm_per_A": null,
   "image_url": "https://cdn.shopify.com/s/files/1/0673/6848/5000/files/INSPIRE-ROBOTS-RH56DFX-main-0.jpg?v=1779024994",
   "image_source": "AI2FitLab / OpenELab 商城商品页归档 商品图",
   "tau_basis": null
  }
 }
]
