[
 {
  "category": "module",
  "subtype": "servo",
  "id": "casbot-casbot-w1-robot",
  "vendor": "CASBOT",
  "model": "CASBOT W1 Robot",
  "title": "CASBOT W1 Robot",
  "url": "https://aifitlab.com/products/casbot-w1-robot",
  "source_tier": "B",
  "verified": false,
  "last_checked": "2026-10-28",
  "price_cny": 67700.0,
  "origin": "AI2FitLab / OpenELab 商城商品页归档（2026-10-28 抓取）",
  "notes": "",
  "specs": {
   "tau_peak_Nm": null,
   "tau_rated_Nm": null,
   "gear": null,
   "speed_noload_rpm": null,
   "mass_kg": null,
   "armature_kgm2": null,
   "voltage_V": null,
   "kt_Nm_per_A": null,
   "image_url": "https://cdn.shopify.com/s/files/1/0673/6848/5000/files/CASBOT_W1-main-1-1.jpg?v=1765973955",
   "image_source": "AI2FitLab / OpenELab 商城商品页归档 商品图",
   "comm": "WiFi + 4G + Bluetooth + 100M Ethernet",
   "ip": "IP68",
   "tau_basis": null
  }
 },
 {
  "category": "module",
  "subtype": "servo",
  "id": "casbot-casbot-handle-l1-robotic-hand",
  "vendor": "CASBOT",
  "model": "CASBOT Handle-L1 Robotic Hand",
  "title": "CASBOT Handle-L1 Robotic Hand",
  "url": "https://aifitlab.com/products/casbot-handle-l1-robotic-hand",
  "source_tier": "B",
  "verified": false,
  "last_checked": "2026-10-28",
  "price_cny": 2700.0,
  "origin": "AI2FitLab / OpenELab 商城商品页归档（2026-10-28 抓取）",
  "notes": "",
  "specs": {
   "tau_peak_Nm": null,
   "tau_rated_Nm": null,
   "gear": null,
   "speed_noload_rpm": null,
   "mass_kg": 0.61,
   "armature_kgm2": null,
   "voltage_V": 60.0,
   "kt_Nm_per_A": null,
   "image_url": "https://cdn.shopify.com/s/files/1/0673/6848/5000/files/CASBOT_Handle_L1-main-1-1.jpg?v=1766043294",
   "image_source": "AI2FitLab / OpenELab 商城商品页归档 商品图",
   "dims": "194mm*84mm*52mm",
   "comm": "RS485/CANFD/EtherCAT",
   "tau_basis": null
  }
 }
]
