[
 {
  "category": "actuator",
  "subtype": "planetary",
  "id": "eyou-eyou-ph25-motor",
  "vendor": "EYOU",
  "model": "EYOU PH25 Motor",
  "title": "EYOU PH25 Motor",
  "url": "https://aifitlab.com/products/eyou-ph25-motor",
  "source_tier": "B",
  "verified": false,
  "last_checked": "2026-10-28",
  "price_cny": 750.0,
  "origin": "AI2FitLab / OpenELab 商城商品页归档（2026-10-28 抓取）",
  "notes": "",
  "specs": {
   "tau_peak_Nm": 206.0,
   "tau_rated_Nm": 96.0,
   "gear": 81.0,
   "speed_noload_rpm": null,
   "mass_kg": null,
   "armature_kgm2": null,
   "voltage_V": 48.0,
   "kt_Nm_per_A": null,
   "image_url": "https://cdn.shopify.com/s/files/1/0673/6848/5000/files/PH25-1.jpg?v=1752860934",
   "image_source": "AI2FitLab / OpenELab 商城商品页归档 商品图",
   "motor_type": "Internal Rotor Torque Motor",
   "speed_rated_rpm": 38.0,
   "encoder": "Dual Magnetic Encoder",
   "tau_basis": "peak"
  }
 },
 {
  "category": "actuator",
  "subtype": "planetary",
  "id": "eyou-eyou-ph20-motor",
  "vendor": "EYOU",
  "model": "EYOU PH20 Motor",
  "title": "EYOU PH20 Motor",
  "url": "https://aifitlab.com/products/eyou-ph20-motor",
  "source_tier": "B",
  "verified": false,
  "last_checked": "2026-10-28",
  "price_cny": 700.0,
  "origin": "AI2FitLab / OpenELab 商城商品页归档（2026-10-28 抓取）",
  "notes": "",
  "specs": {
   "tau_peak_Nm": 104.0,
   "tau_rated_Nm": 52.0,
   "gear": 81.0,
   "speed_noload_rpm": null,
   "mass_kg": null,
   "armature_kgm2": null,
   "voltage_V": 48.0,
   "kt_Nm_per_A": null,
   "image_url": "https://cdn.shopify.com/s/files/1/0673/6848/5000/files/PH20-1.jpg?v=1752862280",
   "image_source": "AI2FitLab / OpenELab 商城商品页归档 商品图",
   "motor_type": "Internal Rotor Torque Motor",
   "speed_rated_rpm": 38.0,
   "encoder": "Dual Magnetic Encoder",
   "tau_basis": "peak"
  }
 },
 {
  "category": "actuator",
  "subtype": "planetary",
  "id": "eyou-eyou-ph17-motor",
  "vendor": "EYOU",
  "model": "EYOU PH17 Motor",
  "title": "EYOU PH17 Motor",
  "url": "https://aifitlab.com/products/eyou-ph17-motor",
  "source_tier": "B",
  "verified": false,
  "last_checked": "2026-10-28",
  "price_cny": 660.0,
  "origin": "AI2FitLab / OpenELab 商城商品页归档（2026-10-28 抓取）",
  "notes": "",
  "specs": {
   "tau_peak_Nm": 52.0,
   "tau_rated_Nm": 22.0,
   "gear": 51.0,
   "speed_noload_rpm": null,
   "mass_kg": null,
   "armature_kgm2": null,
   "voltage_V": 48.0,
   "kt_Nm_per_A": null,
   "image_url": "https://cdn.shopify.com/s/files/1/0673/6848/5000/files/PH17-1.jpg?v=1752840185",
   "image_source": "AI2FitLab / OpenELab 商城商品页归档 商品图",
   "motor_type": "Internal Rotor Torque Motor",
   "speed_rated_rpm": 60.0,
   "encoder": "Dual Magnetic Encoder",
   "tau_basis": "peak"
  }
 },
 {
  "category": "actuator",
  "subtype": "planetary",
  "id": "eyou-eyou-ph14-motor",
  "vendor": "EYOU",
  "model": "EYOU PH14 Motor",
  "title": "EYOU PH14 Motor",
  "url": "https://aifitlab.com/products/eyou-ph14-motor",
  "source_tier": "B",
  "verified": false,
  "last_checked": "2026-10-28",
  "price_cny": 620.0,
  "origin": "AI2FitLab / OpenELab 商城商品页归档（2026-10-28 抓取）",
  "notes": "",
  "specs": {
   "tau_peak_Nm": 38.0,
   "tau_rated_Nm": 12.0,
   "gear": 51.0,
   "speed_noload_rpm": null,
   "mass_kg": null,
   "armature_kgm2": null,
   "voltage_V": 48.0,
   "kt_Nm_per_A": null,
   "image_url": "https://cdn.shopify.com/s/files/1/0673/6848/5000/files/PH14-1.jpg?v=1752845724",
   "image_source": "AI2FitLab / OpenELab 商城商品页归档 商品图",
   "motor_type": "Internal Rotor Torque Motor",
   "speed_rated_rpm": 60.0,
   "encoder": "Dual Magnetic Encoder",
   "tau_basis": "peak"
  }
 },
 {
  "category": "actuator",
  "subtype": "planetary",
  "id": "eyou-eyou-ph11-motor",
  "vendor": "EYOU",
  "model": "EYOU PH11 Motor",
  "title": "EYOU PH11 Motor",
  "url": "https://aifitlab.com/products/eyou-ph11-motor",
  "source_tier": "B",
  "verified": false,
  "last_checked": "2026-10-28",
  "price_cny": 580.0,
  "origin": "AI2FitLab / OpenELab 商城商品页归档（2026-10-28 抓取）",
  "notes": "",
  "specs": {
   "tau_peak_Nm": 6.8,
   "tau_rated_Nm": 3.5,
   "gear": 51.0,
   "speed_noload_rpm": null,
   "mass_kg": null,
   "armature_kgm2": null,
   "voltage_V": 36.0,
   "kt_Nm_per_A": null,
   "image_url": "https://cdn.shopify.com/s/files/1/0673/6848/5000/files/PH11-1.jpg?v=1752863513",
   "image_source": "AI2FitLab / OpenELab 商城商品页归档 商品图",
   "motor_type": "Internal Rotor Torque Motor",
   "speed_rated_rpm": 60.0,
   "encoder": "Dual Magnetic Encoder",
   "tau_basis": "peak"
  }
 },
 {
  "category": "actuator",
  "subtype": "planetary",
  "id": "eyou-eyou-ph08-motor",
  "vendor": "EYOU",
  "model": "EYOU PH08 Motor",
  "title": "EYOU PH08 Motor",
  "url": "https://aifitlab.com/products/eyou-ph08-motor",
  "source_tier": "B",
  "verified": false,
  "last_checked": "2026-10-28",
  "price_cny": 500.0,
  "origin": "AI2FitLab / OpenELab 商城商品页归档（2026-10-28 抓取）",
  "notes": "",
  "specs": {
   "tau_peak_Nm": 2.8,
   "tau_rated_Nm": 1.0,
   "gear": 51.0,
   "speed_noload_rpm": null,
   "mass_kg": null,
   "armature_kgm2": null,
   "voltage_V": 36.0,
   "kt_Nm_per_A": null,
   "image_url": "https://cdn.shopify.com/s/files/1/0673/6848/5000/files/PH08-1.jpg?v=1752849655",
   "image_source": "AI2FitLab / OpenELab 商城商品页归档 商品图",
   "motor_type": "Internal Rotor Torque Motor",
   "speed_rated_rpm": 60.0,
   "encoder": "Dual Magnetic Encoder",
   "tau_basis": "peak"
  }
 },
 {
  "category": "actuator",
  "subtype": "planetary",
  "id": "eyou-eyou-pp11-motor",
  "vendor": "EYOU",
  "model": "EYOU PP11 Motor",
  "title": "EYOU PP11 Motor",
  "url": "https://aifitlab.com/products/eyou-pp11-motor",
  "source_tier": "B",
  "verified": false,
  "last_checked": "2026-10-28",
  "price_cny": 300.0,
  "origin": "AI2FitLab / OpenELab 商城商品页归档（2026-10-28 抓取）",
  "notes": "",
  "specs": {
   "tau_peak_Nm": 14.0,
   "tau_rated_Nm": 6.6,
   "gear": 36.0,
   "speed_noload_rpm": null,
   "mass_kg": 0.391,
   "armature_kgm2": null,
   "voltage_V": 24.0,
   "kt_Nm_per_A": 2.2,
   "image_url": "https://cdn.shopify.com/s/files/1/0673/6848/5000/files/PP11-1.jpg?v=1752831509",
   "image_source": "AI2FitLab / OpenELab 商城商品页归档 商品图",
   "motor_type": "Brushless Torque Motor",
   "speed_rated_rpm": 50.0,
   "tau_basis": "peak"
  }
 },
 {
  "category": "actuator",
  "subtype": "planetary",
  "id": "eyou-eyou-pp08-motor",
  "vendor": "EYOU",
  "model": "EYOU PP08 Motor",
  "title": "EYOU PP08 Motor",
  "url": "https://aifitlab.com/products/eyou-pp08-motor",
  "source_tier": "B",
  "verified": false,
  "last_checked": "2026-10-28",
  "price_cny": 260.0,
  "origin": "AI2FitLab / OpenELab 商城商品页归档（2026-10-28 抓取）",
  "notes": "",
  "specs": {
   "tau_peak_Nm": 2.2,
   "tau_rated_Nm": 1.0,
   "gear": 36.0,
   "speed_noload_rpm": null,
   "mass_kg": 0.19,
   "armature_kgm2": null,
   "voltage_V": 24.0,
   "kt_Nm_per_A": 1.1,
   "image_url": "https://cdn.shopify.com/s/files/1/0673/6848/5000/files/PP08-1.jpg?v=1752833357",
   "image_source": "AI2FitLab / OpenELab 商城商品页归档 商品图",
   "motor_type": "Brushless Torque Motor",
   "speed_rated_rpm": 50.0,
   "tau_basis": "peak"
  }
 },
 {
  "category": "actuator",
  "subtype": "planetary",
  "id": "eyou-eyou-pp05-motor",
  "vendor": "EYOU",
  "model": "EYOU PP05 Motor",
  "title": "EYOU PP05 Motor",
  "url": "https://aifitlab.com/products/eyou-pp05-motor",
  "source_tier": "B",
  "verified": false,
  "last_checked": "2026-10-28",
  "price_cny": 170.0,
  "origin": "AI2FitLab / OpenELab 商城商品页归档（2026-10-28 抓取）",
  "notes": "",
  "specs": {
   "tau_peak_Nm": 0.48,
   "tau_rated_Nm": 0.2,
   "gear": 6.0,
   "speed_noload_rpm": null,
   "mass_kg": 0.086,
   "armature_kgm2": null,
   "voltage_V": 24.0,
   "kt_Nm_per_A": null,
   "image_url": "https://cdn.shopify.com/s/files/1/0673/6848/5000/files/PP05-main-1.jpg?v=1759744821",
   "image_source": "AI2FitLab / OpenELab 商城商品页归档 商品图",
   "motor_type": "Brushless Torque Motor",
   "encoder": "Absolute Encoder",
   "speed_rated_rpm": 50.0,
   "comm": "CAN",
   "tau_basis": "peak"
  }
 }
]
