[
 {
  "category": "actuator",
  "subtype": "planetary",
  "id": "linkdynamics-linkdynamics-p80-motor",
  "vendor": "LinkDynamics",
  "model": "LinkDynamics P80 Motor",
  "title": "LinkDynamics P80 Motor",
  "url": "https://aifitlab.com/products/linkdynamics-p80-motor",
  "source_tier": "B",
  "verified": false,
  "last_checked": "2026-10-28",
  "price_cny": 400.0,
  "origin": "AI2FitLab / OpenELab 商城商品页归档（2026-10-28 抓取）",
  "notes": "",
  "specs": {
   "tau_peak_Nm": 80.0,
   "tau_rated_Nm": 20.0,
   "gear": 16.0,
   "speed_noload_rpm": null,
   "mass_kg": 0.81,
   "armature_kgm2": null,
   "voltage_V": 48.0,
   "kt_Nm_per_A": 4.4,
   "image_url": "https://cdn.shopify.com/s/files/1/0673/6848/5000/files/LinkDynamics-P80-main-1.jpg?v=1785231015",
   "image_source": "AI2FitLab / OpenELab 商城商品页归档 商品图",
   "speed_rated_rpm": 70.0,
   "comm": "CAN/CAN FD",
   "encoder": "Dual Magnetic Encoder 14Bit",
   "tau_basis": "peak"
  }
 },
 {
  "category": "actuator",
  "subtype": "planetary",
  "id": "linkdynamics-linkdynamics-p50-motor",
  "vendor": "LinkDynamics",
  "model": "LinkDynamics P50 Motor",
  "title": "LinkDynamics P50 Motor",
  "url": "https://aifitlab.com/products/linkdynamics-p50-motor",
  "source_tier": "B",
  "verified": false,
  "last_checked": "2026-10-28",
  "price_cny": 270.0,
  "origin": "AI2FitLab / OpenELab 商城商品页归档（2026-10-28 抓取）",
  "notes": "",
  "specs": {
   "tau_peak_Nm": 36.0,
   "tau_rated_Nm": 12.0,
   "gear": 36.0,
   "speed_noload_rpm": null,
   "mass_kg": 0.39,
   "armature_kgm2": null,
   "voltage_V": 48.0,
   "kt_Nm_per_A": 4.8,
   "image_url": "https://cdn.shopify.com/s/files/1/0673/6848/5000/files/LinkDynamics-P50-main-1.jpg?v=1785231743",
   "image_source": "AI2FitLab / OpenELab 商城商品页归档 商品图",
   "speed_rated_rpm": 77.0,
   "comm": "CAN/CAN FD",
   "encoder": "Dual Magnetic Encoder 14Bit",
   "tau_basis": "peak"
  }
 },
 {
  "category": "actuator",
  "subtype": "planetary",
  "id": "linkdynamics-linkdynamics-pa43-motor",
  "vendor": "LinkDynamics",
  "model": "LinkDynamics PA43 Motor",
  "title": "LinkDynamics PA43 Motor",
  "url": "https://aifitlab.com/products/linkdynamics-pa43-motor",
  "source_tier": "B",
  "verified": false,
  "last_checked": "2026-10-28",
  "price_cny": 190.0,
  "origin": "AI2FitLab / OpenELab 商城商品页归档（2026-10-28 抓取）",
  "notes": "",
  "specs": {
   "tau_peak_Nm": 18.0,
   "tau_rated_Nm": 5.0,
   "gear": 20.25,
   "speed_noload_rpm": null,
   "mass_kg": 0.263,
   "armature_kgm2": null,
   "voltage_V": 48.0,
   "kt_Nm_per_A": 3.42,
   "image_url": "https://cdn.shopify.com/s/files/1/0673/6848/5000/files/LinkDynamics-PA43-main-1.jpg?v=1785237922",
   "image_source": "AI2FitLab / OpenELab 商城商品页归档 商品图",
   "speed_rated_rpm": 100.0,
   "comm": "CAN/CAN FD",
   "encoder": "Dual Magnetic Encoder 14Bit",
   "tau_basis": "peak"
  }
 },
 {
  "category": "actuator",
  "subtype": "planetary",
  "id": "linkdynamics-linkdynamics-ht52-motor",
  "vendor": "LinkDynamics",
  "model": "LinkDynamics HT52 Motor",
  "title": "LinkDynamics HT52 Motor",
  "url": "https://aifitlab.com/products/linkdynamics-ht52-motor",
  "source_tier": "B",
  "verified": false,
  "last_checked": "2026-10-28",
  "price_cny": 110.0,
  "origin": "AI2FitLab / OpenELab 商城商品页归档（2026-10-28 抓取）",
  "notes": "",
  "specs": {
   "tau_peak_Nm": 5.6,
   "tau_rated_Nm": 2.3,
   "gear": 36.0,
   "speed_noload_rpm": null,
   "mass_kg": 0.27,
   "armature_kgm2": null,
   "voltage_V": 48.0,
   "kt_Nm_per_A": 1.15,
   "image_url": "https://cdn.shopify.com/s/files/1/0673/6848/5000/files/LinkDynamics-HT52-main-1.jpg?v=1785238144",
   "image_source": "AI2FitLab / OpenELab 商城商品页归档 商品图",
   "speed_rated_rpm": 111.0,
   "comm": "CAN",
   "encoder": "Dual Magnetic Encoder 15Bit",
   "tau_basis": "peak"
  }
 }
]
