[
 {
  "category": "module",
  "subtype": "servo",
  "id": "ti5-robot-ti5-robot-cool-hand",
  "vendor": "Ti5 ROBOT",
  "model": "Ti5 ROBOT Cool Hand",
  "title": "Ti5 ROBOT Cool Hand",
  "url": "https://aifitlab.com/products/ti5-robot-cool-hand",
  "source_tier": "B",
  "verified": false,
  "last_checked": "2026-10-28",
  "price_cny": 2945.0,
  "origin": "AI2FitLab / OpenELab 商城商品页归档（2026-10-28 抓取）",
  "notes": "",
  "specs": {
   "tau_peak_Nm": null,
   "tau_rated_Nm": null,
   "gear": null,
   "speed_noload_rpm": null,
   "mass_kg": 0.48,
   "armature_kgm2": null,
   "voltage_V": 12.0,
   "kt_Nm_per_A": null,
   "image_url": "https://cdn.shopify.com/s/files/1/0673/6848/5000/files/Bionic_Robot_Hand-main-new.jpg?v=1758298719",
   "image_source": "AI2FitLab / OpenELab 商城商品页归档 商品图",
   "tau_basis": null
  }
 },
 {
  "category": "module",
  "subtype": "servo",
  "id": "ti5-robot-ti5-robot-eblm-series",
  "vendor": "Ti5 ROBOT",
  "model": "Ti5 ROBOT EBLM Series",
  "title": "Ti5 ROBOT EBLM Series",
  "url": "https://aifitlab.com/products/ti5-robot-eblm-series",
  "source_tier": "B",
  "verified": false,
  "last_checked": "2026-10-28",
  "price_cny": 320.0,
  "origin": "AI2FitLab / OpenELab 商城商品页归档（2026-10-28 抓取）",
  "notes": "",
  "specs": {
   "tau_peak_Nm": null,
   "tau_rated_Nm": null,
   "gear": null,
   "speed_noload_rpm": null,
   "mass_kg": null,
   "armature_kgm2": null,
   "voltage_V": null,
   "kt_Nm_per_A": null,
   "image_url": "https://cdn.shopify.com/s/files/1/0673/6848/5000/files/Ti5-EBLM-logo-1.jpg?v=1758295978",
   "image_source": "AI2FitLab / OpenELab 商城商品页归档 商品图",
   "ip": "IP50",
   "temp_range": "0°C～50°C",
   "tau_basis": null
  }
 },
 {
  "category": "module",
  "subtype": "servo",
  "id": "ti5-robot-ti5-robot-arm-series",
  "vendor": "Ti5 ROBOT",
  "model": "Ti5 ROBOT ARM Series",
  "title": "Ti5 ROBOT ARM Series",
  "url": "https://aifitlab.com/products/ti5-robot-arm-series",
  "source_tier": "B",
  "verified": false,
  "last_checked": "2026-10-28",
  "price_cny": 320.0,
  "origin": "AI2FitLab / OpenELab 商城商品页归档（2026-10-28 抓取）",
  "notes": "",
  "specs": {
   "tau_peak_Nm": null,
   "tau_rated_Nm": null,
   "gear": null,
   "speed_noload_rpm": null,
   "mass_kg": null,
   "armature_kgm2": null,
   "voltage_V": null,
   "kt_Nm_per_A": null,
   "image_url": "https://cdn.shopify.com/s/files/1/0673/6848/5000/files/Robot-Arm-logo-2.jpg?v=1758294852",
   "image_source": "AI2FitLab / OpenELab 商城商品页归档 商品图",
   "ip": "IP50",
   "temp_range": "0°C～50°C",
   "tau_basis": null
  }
 }
]
